{
  "type": "object",
  "required": [
    "count",
    "items",
    "next",
    "page_size",
    "previous",
    "total_pages"
  ],
  "$schema": "https://json-schema.org/draft/2020-12/schema",
  "properties": {
    "count": {
      "type": "integer"
    },
    "items": {
      "type": "array",
      "items": {
        "type": "object",
        "required": [
          "distance",
          "fias_id",
          "has_shop",
          "lat",
          "lon",
          "name",
          "slug"
        ],
        "properties": {
          "distance": {
            "type": "number"
          },
          "fias_id": {
            "type": "string",
            "format": "uuid"
          },
          "has_shop": {
            "type": "boolean"
          },
          "lat": {
            "type": "number"
          },
          "lon": {
            "type": "number"
          },
          "name": {
            "type": "string",
            "j2sEnumRejected": true
          },
          "slug": {
            "type": "string",
            "enum": [
              "armiansk",
              "arkhangelsk",
              "arzamas",
              "arkadak",
              "ardatov",
              "armavir",
              "arsk",
              "ardon",
              "argun",
              "aramil",
              "artemovskii",
              "artemovsk",
              "arsenev",
              "artem"
            ]
          }
        }
      }
    },
    "next": {
      "type": "null"
    },
    "page_size": {
      "type": "integer"
    },
    "previous": {
      "type": "null"
    },
    "total_pages": {
      "type": "integer"
    }
  }
}